{
  "$schema": "https://json-schema.org/draft/2020-12/schema",
  "$id": "urn:civicloop:schema:agents:agent-step:v1",
  "title": "Agent step v1",
  "type": "object",
  "additionalProperties": false,
  "required": ["schema_version", "step_id", "run_id", "sequence", "kind", "status", "started_at", "finished_at", "input_summary", "output_summary", "failure_category", "telemetry"],
  "properties": {
    "schema_version": { "const": "1.0" },
    "step_id": { "type": "string", "format": "uuid", "maxLength": 36 },
    "run_id": { "type": "string", "format": "uuid", "maxLength": 36 },
    "sequence": { "type": "integer", "minimum": 1, "maximum": 1000 },
    "kind": { "enum": ["planning", "model_inference", "tool_call", "validation", "repair"] },
    "status": { "enum": ["pending", "running", "succeeded", "failed", "skipped"] },
    "started_at": { "type": ["string", "null"], "format": "date-time", "maxLength": 40 },
    "finished_at": { "type": ["string", "null"], "format": "date-time", "maxLength": 40 },
    "input_summary": { "type": ["string", "null"], "maxLength": 500 },
    "output_summary": { "type": ["string", "null"], "maxLength": 500 },
    "failure_category": { "type": ["string", "null"], "enum": [null, "invalid_output", "provider_unavailable", "timeout", "tool_denied", "tool_error"] },
    "telemetry": { "$ref": "#/$defs/telemetry" }
  },
  "$defs": {
    "telemetry": {
      "type": "object",
      "additionalProperties": false,
      "required": ["duration_ms", "input_tokens", "output_tokens"],
      "properties": {
        "duration_ms": { "type": "integer", "minimum": 0, "maximum": 3600000 },
        "input_tokens": { "type": "integer", "minimum": 0, "maximum": 10000000 },
        "output_tokens": { "type": "integer", "minimum": 0, "maximum": 10000000 }
      }
    }
  }
}
